<?xml version="1.0" encoding="UTF-8"?>
<flow xmlns="http://www.springframework.org/schema/webflow" xmlns:xsi="http://www.w3.org/2001/XMLSchema-instance"
	xsi:schemaLocation="http://www.springframework.org/schema/webflow http://www.springframework.org/schema/webflow/spring-webflow-1.0.xsd">

	<start-state idref="enterGuess"/>
	
	<view-state id="enterGuess" view="mastermind.enterGuess">
		<transition on="submit" to="guess"/>
	</view-state>
	
	<action-state id="guess">
		<bean-action bean="game" method="makeGuess">
			<method-arguments>
				<argument expression="requestParameters.guess" parameter-type="int"/>
			</method-arguments>
			<method-result name="guessResult"/>
		</bean-action>
		<transition on="correct" to="showAnswer"/>
		<transition on="*" to="enterGuess"/>
	</action-state>
	
	<end-state id="showAnswer" view="mastermind.showAnswer"/>
 
	<import resource="mastermind-beans.xml"/>

</flow>