<?xml version="1.0" encoding="UTF-8"?>
<flow xmlns="http://www.springframework.org/schema/webflow"
      xmlns:xsi="http://www.w3.org/2001/XMLSchema-instance"
      xsi:schemaLocation="http://www.springframework.org/schema/webflow
                          http://www.springframework.org/schema/webflow/spring-webflow-1.0.xsd">

	<start-state idref="enterCriteria"/>

	<view-state id="enterCriteria" view="searchCriteria">
		<entry-actions>
			<action bean="formAction" method="setupForm"/>
		</entry-actions>
		<transition on="search" to="executeSearch">
			<action bean="formAction" method="bindAndValidate"/>
		</transition>
	</view-state>

	<action-state id="executeSearch">
		<bean-action bean="phonebook" method="search">
			<method-arguments>
				<argument expression="flowScope.searchCriteria"/>			
			</method-arguments>
			<method-result name="results"/>
		</bean-action>
		<transition on="success" to="displayResults"/>
	</action-state>	
	
	<view-state id="displayResults" view="searchResults">
		<transition on="newSearch" to="enterCriteria"/>
		<transition on="select" to="browseDetails"/>
	</view-state>

	<subflow-state id="browseDetails" flow="detail-flow">
		<attribute-mapper>
			<input-mapper>
				<mapping source="${requestParameters.id}" target="id" from="string" to="long"/>
			</input-mapper>
		</attribute-mapper>
		<transition on="finish" to="executeSearch"/>
	</subflow-state>

	<import resource="search-flow-beans.xml"/>
	
</flow>